ryandelahoz,RT UbisoftStudioSF Tomorrow well stream our holiday special at 2pm PT5pm ET10pm GMT httpstcoPMiTz7DUvN Win an Orange amp http,37.78405,-122.4139404
engineerofsound,"Butckus broxiel ""Holiday Special"" xD dice clarito la wea ",34.04283513,-118.2641915
SpecialXtra,Advil is my holiday go-to for ridding myself of those holiday aches amp pains  httpstcoCaJvQXnCip fastadvilfanatics sponsored,37.7909508,-122.4161224
ChristyPhan1,Are you looking for something absolutely incredible for the holiday season Maybe a beautiful httpstcoxKBdR5NmBe,37.73299566,-122.1508186
SimplyAlyson,RT chanelpuke tis the season to spread holiday cheer httpstcoQN5W1E7vN1,32.73082345,-117.1507672
Fonziie,I just added this to my closet on Poshmark Perfect holiday blouse httpstcouId65WvKSp via poshmarkapp shopmycloset,37.78973336,-122.4070806
olstumpbrewery,RT TheGodlessNorth Holy shit Starbucks went pretty fucking dark this holiday season Oh wait thats supposed to be a scarf httpstc,34.0976143,-117.7541275
lindsayALBANESE,RT RobertIrvine Only ten minutes till holiday impossible  are you ready everyone ,34.0522,-118.243
HectorCeniceros,RT JODYHiGHROLLER iF YOU ARE BUYiNG A PET FOR YOUR FAMiLY THiS HOLiDAY SEASON PLEASE CONSiDER ADOPTiNG BECUZ THERE iS MANY LOViNG ANiMALS,33.933917,-117.966673
xain,HANADEEN Holiday 2015  Holiday BB Tee  available in black cobalt or champagne  S-MM-L  64 httpstcogiItEauI3U,37.75448754,-122.4185609
Jessica_DeLuca,Nothing gets me in the holiday spirit quite like michaelbuble and his Christmas special MerryChristmas,37.8100319,-121.9902725
jenstoddart,RT CarlaYoung I have this one and love it GoodyTips  httpstcogG1dwooAZt,33.74087307,-118.0333543
woelfelryan,RT dashomo You ask Papyrus to go holiday shopping He can barely hide his joy Your other friends end up coming along too httpstc,34.01539261,-118.4989697
zmorvant,RT chanelpuke tis the season to spread holiday cheer httpstcoQN5W1E7vN1,37.7876587,-122.4182281
123Joleen,Fred couldnt tell his mom he stayed in his room because he did land a holiday job but he smoked all the weed he was supposed to deliver,34.05085174,-118.256974
BelAgeBoutique,Check out my ThatsJared Holiday Wish List amp make your own for a chance to win No pur nec Ends 122015 18 httpstco5aT7CeLkmu,32.7515602,-117.1779175
BelAgeBoutique,Wow Enter to  goodies from quip for a fabulous holiday meal worth 1000    sweepstakes  httpstco1Tyb6aPbJP,32.7515602,-117.1779175
chinacat_,RT SpaceshipsLB Wow What a wonderful evening Dont forget to pick up your holiday must-haves at your local Walgreens InfinitiveAtWal,33.9583015,-118.3418579
Fortune421,Thieves target homes with holiday decorations News SanAntonio httpstcosE1WYb46A3,32.712204,-117.1603165
feastfashionfav,MomsShopWalmart this holiday season Get great PampG packs and more Win giftcard with yyzbambina PGmomgiveaway httpstco7vRfJUOudT,33.5359688,-117.7769089
neur0sis,Check out my ThatsJared Holiday Wish List amp make your own for a chance to win No pur nec Ends 122015 18 httpstcoc3TgmFuhFU,37.775,-122.418
jimontheradio,RT YMCbuzz Im asking for the GoodyHair QuikStyle HairBrush because time is of the essence this holiday season GoodyTips httpstcoj,34.4186783,-119.6974716
LaineyNuguid,Joplin HS Band amp MSSU Wind Ensemble at the annual JHS holiday concert httpstcoe8KZU1uFut,34.04837415,-118.2588666
Olgaloera,Handmade NECKLACE  SCARF with Heart Pendant WOMENS ACCESSORY Christmas Holiday - Bid Now httpstcoxZp30n5EX7 httpstco98GCicKGrB,34.07453768,-118.3982295
margaretobrien,RT waitcrimes This holiday season dont forget to tip your server  kellriches  waitcrimes serverlife httpstcoIUKHTvmrlB,33.5381508,-117.7792664
